[
  {
    "customer_id": "CUST-0001",
    "first_name": "Nadia",
    "last_name": "Benali",
    "email": "nadia.benali@example.test",
    "phone": "+33 6 00 00 01 01",
    "segment": "standard",
    "created_at": "2026-08--9T10:00:00Z",
    "language": "fr",
    "notes": "Préfère être contactée par e-mail."
  },
  {
    "customer_id": "CUST-0002",
    "first_name": "Marc",
    "last_name": "Lefèvre",
    "email": "marc.lefevre@example.test",
    "phone": "+33 6 00 00 02 02",
    "segment": "premium",
    "created_at": "2026-08--89T10:00:00Z",
    "language": "fr",
    "notes": "Client premium depuis 2025. Deux réclamations résolues en sa faveur."
  },
  {
    "customer_id": "CUST-0003",
    "first_name": "Sofia",
    "last_name": "Rinaldi",
    "email": "sofia.rinaldi@example.test",
    "phone": "+39 300 000 0303",
    "segment": "standard",
    "created_at": "2026-08-16T10:00:00Z",
    "language": "fr",
    "notes": ""
  },
  {
    "customer_id": "CUST-0004",
    "first_name": "Youssef",
    "last_name": "El Amrani",
    "email": "y.elamrani@example.test",
    "phone": "+33 6 00 00 04 04",
    "segment": "standard",
    "created_at": "2026-08--169T10:00:00Z",
    "language": "fr",
    "notes": "A demandé la suppression de son numéro de téléphone des communications marketing."
  },
  {
    "customer_id": "CUST-0005",
    "first_name": "Claire",
    "last_name": "Dubois",
    "email": "claire.dubois@example.test",
    "phone": "+33 6 00 00 05 05",
    "segment": "premium",
    "created_at": "2026-08--269T10:00:00Z",
    "language": "fr",
    "notes": "Livraisons au bureau, jamais le lundi."
  },
  {
    "customer_id": "CUST-0006",
    "first_name": "Tomas",
    "last_name": "Novak",
    "email": "tomas.novak@example.test",
    "phone": "+420 600 000 606",
    "segment": "standard",
    "created_at": "2026-08-26T10:00:00Z",
    "language": "fr",
    "notes": ""
  }
]
